{
  "version": "2",
  "meta": {
    "title": "Capo Waltz",
    "bpm": 96,
    "time_signature": [
      3,
      4
    ],
    "source": "capo_waltz.tab"
  },
  "sections": [],
  "tracks": [
    {
      "id": "guitar",
      "role": "melody",
      "instrument": "gm:25",
      "events": [
        {
          "type": "note",
          "start": "0",
          "duration": "1/2",
          "pitch": 50
        },
        {
          "type": "note",
          "start": "1/2",
          "duration": "1/2",
          "pitch": 62
        },
        {
          "type": "note",
          "start": "1",
          "duration": "1/2",
          "pitch": 66
        },
        {
          "type": "note",
          "start": "3/2",
          "duration": "1/2",
          "pitch": 62
        },
        {
          "type": "note",
          "start": "2",
          "duration": "1/2",
          "pitch": 66
        },
        {
          "type": "note",
          "start": "5/2",
          "duration": "1/2",
          "pitch": 62
        },
        {
          "type": "note",
          "start": "3",
          "duration": "1/2",
          "pitch": 50
        },
        {
          "type": "note",
          "start": "7/2",
          "duration": "1/2",
          "pitch": 62
        },
        {
          "type": "note",
          "start": "4",
          "duration": "1/2",
          "pitch": 66
        },
        {
          "type": "note",
          "start": "9/2",
          "duration": "1/2",
          "pitch": 62
        },
        {
          "type": "note",
          "start": "5",
          "duration": "1/2",
          "pitch": 66
        },
        {
          "type": "note",
          "start": "11/2",
          "duration": "1/2",
          "pitch": 62
        },
        {
          "type": "note",
          "start": "6",
          "duration": "1/2",
          "pitch": 43
        },
        {
          "type": "note",
          "start": "13/2",
          "duration": "1/2",
          "pitch": 59
        },
        {
          "type": "note",
          "start": "13/2",
          "duration": "1/2",
          "pitch": 62
        },
        {
          "type": "note",
          "start": "7",
          "duration": "1/2",
          "pitch": 67
        },
        {
          "type": "note",
          "start": "15/2",
          "duration": "1/2",
          "pitch": 59
        },
        {
          "type": "note",
          "start": "15/2",
          "duration": "1/2",
          "pitch": 62
        },
        {
          "type": "note",
          "start": "8",
          "duration": "1/2",
          "pitch": 67
        },
        {
          "type": "note",
          "start": "17/2",
          "duration": "1/2",
          "pitch": 59
        },
        {
          "type": "note",
          "start": "17/2",
          "duration": "1/2",
          "pitch": 62
        },
        {
          "type": "note",
          "start": "9",
          "duration": "1/2",
          "pitch": 45
        },
        {
          "type": "note",
          "start": "19/2",
          "duration": "1/2",
          "pitch": 61
        },
        {
          "type": "note",
          "start": "10",
          "duration": "1/2",
          "pitch": 69
        },
        {
          "type": "note",
          "start": "21/2",
          "duration": "1/2",
          "pitch": 61
        },
        {
          "type": "note",
          "start": "11",
          "duration": "1/2",
          "pitch": 69
        },
        {
          "type": "note",
          "start": "23/2",
          "duration": "1/2",
          "pitch": 61
        }
      ]
    }
  ]
}
