{
  "version": "2",
  "meta": {
    "title": "Triplet Melody",
    "bpm": 90,
    "time_signature": [
      4,
      4
    ],
    "source": "melody_triplets.mid"
  },
  "sections": [],
  "tracks": [
    {
      "id": "lead",
      "role": "melody",
      "instrument": "gm:73",
      "events": [
        {
          "type": "note",
          "start": "0",
          "duration": "1/3",
          "pitch": 64,
          "velocity": 88
        },
        {
          "type": "note",
          "start": "83/240",
          "duration": "157/480",
          "pitch": 67,
          "velocity": 88
        },
        {
          "type": "note",
          "start": "21/32",
          "duration": "79/240",
          "pitch": 69,
          "velocity": 88
        },
        {
          "type": "note",
          "start": "163/160",
          "duration": "13/40",
          "pitch": 71,
          "velocity": 88
        },
        {
          "type": "note",
          "start": "79/60",
          "duration": "13/40",
          "pitch": 69,
          "velocity": 88
        },
        {
          "type": "note",
          "start": "67/40",
          "duration": "79/240",
          "pitch": 67,
          "velocity": 88
        },
        {
          "type": "note",
          "start": "319/160",
          "duration": "479/480",
          "pitch": 64,
          "velocity": 88
        },
        {
          "type": "note",
          "start": "1447/480",
          "duration": "79/160",
          "pitch": 74,
          "velocity": 88
        },
        {
          "type": "note",
          "start": "557/160",
          "duration": "59/120",
          "pitch": 72,
          "velocity": 88
        },
        {
          "type": "note",
          "start": "961/240",
          "duration": "479/480",
          "pitch": 71,
          "velocity": 88
        },
        {
          "type": "note",
          "start": "481/96",
          "duration": "79/240",
          "pitch": 69,
          "velocity": 88
        },
        {
          "type": "note",
          "start": "1277/240",
          "duration": "157/480",
          "pitch": 71,
          "velocity": 88
        },
        {
          "type": "note",
          "start": "341/60",
          "duration": "13/40",
          "pitch": 72,
          "velocity": 88
        },
        {
          "type": "note",
          "start": "719/120",
          "duration": "479/240",
          "pitch": 64,
          "velocity": 88
        }
      ]
    }
  ]
}
