{
  "version": "2",
  "meta": {
    "title": "Bassline",
    "bpm": 100,
    "time_signature": [
      4,
      4
    ],
    "key": "Cm",
    "source": "bassline.mid"
  },
  "sections": [],
  "tracks": [
    {
      "id": "bass",
      "role": "bass",
      "instrument": "gm:33",
      "events": [
        {
          "type": "note",
          "start": "0",
          "duration": "3/2",
          "pitch": 36,
          "velocity": 96
        },
        {
          "type": "note",
          "start": "3/2",
          "duration": "1/2",
          "pitch": 36,
          "velocity": 96
        },
        {
          "type": "note",
          "start": "2",
          "duration": "1",
          "pitch": 39,
          "velocity": 96
        },
        {
          "type": "note",
          "start": "3",
          "duration": "1",
          "pitch": 43,
          "velocity": 96
        },
        {
          "type": "note",
          "start": "4",
          "duration": "1/2",
          "pitch": 41,
          "velocity": 96
        },
        {
          "type": "note",
          "start": "9/2",
          "duration": "1/2",
          "pitch": 41,
          "velocity": 96
        },
        {
          "type": "note",
          "start": "5",
          "duration": "1",
          "pitch": 48,
          "velocity": 96
        },
        {
          "type": "note",
          "start": "6",
          "duration": "1",
          "pitch": 34,
          "velocity": 96
        },
        {
          "type": "note",
          "start": "7",
          "duration": "3",
          "pitch": 43,
          "velocity": 96
        },
        {
          "type": "note",
          "start": "10",
          "duration": "1/2",
          "pitch": 41,
          "velocity": 96
        },
        {
          "type": "note",
          "start": "21/2",
          "duration": "1/2",
          "pitch": 39,
          "velocity": 96
        },
        {
          "type": "note",
          "start": "11",
          "duration": "1",
          "pitch": 36,
          "velocity": 96
        },
        {
          "type": "note",
          "start": "12",
          "duration": "2",
          "pitch": 36,
          "velocity": 96
        },
        {
          "type": "note",
          "start": "14",
          "duration": "1/4",
          "pitch": 43,
          "velocity": 96
        },
        {
          "type": "note",
          "start": "57/4",
          "duration": "1/4",
          "pitch": 41,
          "velocity": 96
        },
        {
          "type": "note",
          "start": "29/2",
          "duration": "1/2",
          "pitch": 39,
          "velocity": 96
        },
        {
          "type": "note",
          "start": "15",
          "duration": "1",
          "pitch": 36,
          "velocity": 96
        }
      ]
    }
  ]
}
